<xs:schema xmlns:xs="http://www.w3.org/2001/XMLSchema">
  <xs:element name="ufl_team">
    <xs:complexType>
      <xs:sequence>
        <xs:element type="xs:string" name="team_name"/>
        <xs:element type="xs:string" name="email"/>
        <xs:element type="xs:integer" name="phone_number"/>
        <xs:element name="players">
          <xs:complexType>
            <xs:sequence>
              <xs:element name="player" maxOccurs="5" minOccurs="3">
                <xs:complexType>
                  <xs:sequence>
                    <xs:element type="xs:string" name="firstname"/>
                    <xs:element type="xs:string" name="lastname"/> 
                    <xs:element type="xs:boolean" name="leaguest"/>
                  </xs:sequence>
                  <xs:attribute type="xs:string" name="gender" use="optional"/>
                </xs:complexType>
              </xs:element>
            </xs:sequence>
          </xs:complexType>
        </xs:element>
      </xs:sequence>
    </xs:complexType>
  </xs:element>
</xs:schema>